{
  "anchor_set": [],
  "artifact_type": "packet",
  "as_of_date": "2025-09-18",
  "config_fingerprint": "7da318e9bf2a3f80782b3370fe5246eff1be663b92e098a6cfdb97b904eb55c7",
  "data_status": {
    "issues": [
      {
        "field": "anchor_set.base_high",
        "reason": "breakout_pivot_not_found",
        "status": "low_confidence"
      },
      {
        "field": "anchor_set.daily_proxy_avwap",
        "reason": "pivot_low_not_found",
        "status": "low_confidence"
      },
      {
        "field": "anchor_set.prior_swing_low",
        "reason": "pivot_low_not_found",
        "status": "low_confidence"
      }
    ],
    "overall_status": "low_confidence"
  },
  "derived_features": {
    "feature_status": "ok",
    "values": [
      {
        "name": "atr14",
        "status": "ok",
        "value": 3.857142857142857
      },
      {
        "name": "atr14_pct",
        "status": "ok",
        "units": "pct",
        "value": 0.012814428096820124
      },
      {
        "name": "atr_contraction_ratio",
        "status": "ok",
        "units": "pct",
        "value": 1.598684210526316
      },
      {
        "name": "base_depth_pct",
        "status": "ok",
        "units": "pct",
        "value": 0.07692307692307693
      },
      {
        "name": "base_length_bars",
        "status": "ok",
        "value": 30.0
      },
      {
        "name": "ema10",
        "status": "ok",
        "value": 297.712044337925
      },
      {
        "name": "ema10_distance_from_close_pct",
        "status": "ok",
        "units": "pct",
        "value": 0.011044080092180978
      },
      {
        "name": "ema10_slope",
        "status": "ok",
        "units": "ratio",
        "value": 0.0024602781335415227
      },
      {
        "name": "ema21",
        "status": "ok",
        "value": 297.8528099379283
      },
      {
        "name": "ema21_distance_from_close_pct",
        "status": "ok",
        "units": "pct",
        "value": 0.010566259431050988
      },
      {
        "name": "ema21_slope",
        "status": "ok",
        "units": "ratio",
        "value": 0.0010577435824153936
      },
      {
        "name": "excess_return_percentile_21d",
        "status": "ok",
        "units": "pct",
        "value": 1.0
      },
      {
        "name": "excess_return_percentile_63d",
        "status": "ok",
        "units": "pct",
        "value": 1.0
      },
      {
        "name": "excess_return_vs_spy_21d",
        "status": "ok",
        "units": "pct",
        "value": -0.022848246407607666
      },
      {
        "name": "excess_return_vs_spy_63d",
        "status": "ok",
        "units": "pct",
        "value": 0.07007655201342282
      },
      {
        "name": "gap_pct",
        "status": "ok",
        "units": "pct",
        "value": 0.011784511784511785
      },
      {
        "name": "gap_vs_prior_range_pct",
        "status": "ok",
        "units": "pct",
        "value": 0.008417508417508417
      },
      {
        "name": "median_dollar_volume_50d",
        "status": "ok",
        "value": 719857500.0
      },
      {
        "name": "median_volume_50d",
        "status": "ok",
        "value": 2460000.0
      },
      {
        "name": "overhead_supply_proximity_pct",
        "status": "ok",
        "units": "pct",
        "value": 0.036544850498338874
      },
      {
        "name": "pivot_price",
        "status": "ok",
        "value": 312.0
      },
      {
        "name": "pullback_depth_pct",
        "status": "ok",
        "units": "pct",
        "value": 0.07692307692307693
      },
      {
        "name": "relative_volume_20d",
        "status": "ok",
        "value": 0.9969418960244648
      },
      {
        "name": "return_10d",
        "status": "ok",
        "units": "pct",
        "value": -0.025889967637540454
      },
      {
        "name": "return_21d",
        "status": "ok",
        "units": "pct",
        "value": 0.010067114093959731
      },
      {
        "name": "return_5d",
        "status": "ok",
        "units": "pct",
        "value": 0.030821917808219176
      },
      {
        "name": "return_63d",
        "status": "ok",
        "units": "pct",
        "value": 0.17578125
      },
      {
        "name": "sma100",
        "status": "ok",
        "value": 267.85
      },
      {
        "name": "sma100_distance_from_close_pct",
        "status": "ok",
        "units": "pct",
        "value": 0.12376330035467603
      },
      {
        "name": "sma100_slope",
        "status": "ok",
        "units": "ratio",
        "value": 0.003070816013182227
      },
      {
        "name": "sma200",
        "status": "ok",
        "value": 218.675
      },
      {
        "name": "sma200_distance_from_close_pct",
        "status": "ok",
        "units": "pct",
        "value": 0.37647193323425165
      },
      {
        "name": "sma200_slope",
        "status": "ok",
        "units": "ratio",
        "value": 0.004178816614240236
      },
      {
        "name": "sma50",
        "status": "ok",
        "value": 291.2
      },
      {
        "name": "sma50_distance_from_close_pct",
        "status": "ok",
        "units": "pct",
        "value": 0.033653846153846194
      },
      {
        "name": "sma50_slope",
        "status": "ok",
        "units": "ratio",
        "value": 0.0022026431718061203
      },
      {
        "name": "support_touches",
        "status": "ok",
        "value": 9.0
      },
      {
        "name": "up_down_volume_ratio_20d",
        "status": "ok",
        "units": "pct",
        "value": 3.6771771771771773
      }
    ]
  },
  "eligibility_decision": {
    "gate_results": [
      {
        "message": "passed",
        "rule_name": "instrument_support",
        "status": "passed"
      },
      {
        "message": "passed",
        "rule_name": "freshness",
        "status": "passed"
      },
      {
        "message": "anchor_set_missing",
        "rule_name": "data_sufficiency",
        "status": "failed"
      },
      {
        "message": "passed",
        "rule_name": "liquidity_tradeability",
        "status": "passed"
      },
      {
        "message": "passed",
        "rule_name": "corporate_action_distortion",
        "status": "passed"
      },
      {
        "message": "passed",
        "rule_name": "classification_coherence",
        "status": "passed"
      },
      {
        "message": "passed",
        "rule_name": "setup_specific_integrity",
        "status": "passed"
      },
      {
        "message": "passed",
        "rule_name": "portfolio_warning_gate",
        "status": "passed"
      }
    ],
    "status": "ineligible"
  },
  "environment": "local",
  "generated_at": "2025-09-18T21:15:00Z",
  "operator_review": {
    "packet_summary": "Actionability=ready; trigger=301.00; invalidation=297.85; support=297.85; overhead=312.00; family=trend_pullback; evidence:close_above_sma50; evidence:sma50_above_sma200; evidence:ema21_at_or_above_sma50; evidence:positive_63d_excess_return_vs_spy; evidence:pullback_in_band; evidence:support_proximity_present; base_high anchor status=low_confidence; daily_proxy_avwap anchor status=low_confidence; prior_swing_low anchor status=low_confidence",
    "status": "not_reviewed"
  },
  "outcomes": {
    "outcome_record_refs": [],
    "status": "not_started"
  },
  "packet_id": "pkt_trnd_20250918_02f95006ab180059",
  "prioritization": {
    "method": "transparent_weighted_sum",
    "score_components": [],
    "status": "suppressed"
  },
  "provenance": {
    "artifact_lineage": [
      {
        "artifact_id": "scan/candidate_list_trend_pullback.json",
        "artifact_type": "candidate_list",
        "schema_version": "v1.0.0"
      }
    ],
    "market_data_provider": "yfinance",
    "provider_mode": "baseline"
  },
  "raw_snapshot": {
    "coverage": {
      "bars_available": 220,
      "last_bar_date": "2025-09-18",
      "staleness_days": 0
    },
    "liquidity": {
      "avg_daily_dollar_volume_20d": 740362500.0,
      "avg_daily_volume_20d": 2457750.0
    },
    "price_bar": {
      "close": 301.0,
      "high": 302.0,
      "low": 300.0,
      "open": 300.5,
      "volume": 2445000
    },
    "snapshot_status": "ok"
  },
  "run_id": "run_local_20250918_3e3337a6d2837850",
  "schema_version": "v1.0.0",
  "setup": {
    "classification_status": "ok",
    "family": "trend_pullback",
    "scanner_label": "detected:trend_pullback",
    "scanner_notes": [
      "close_above_sma50",
      "sma50_above_sma200",
      "ema21_at_or_above_sma50",
      "positive_63d_excess_return_vs_spy",
      "pullback_in_band",
      "support_proximity_present"
    ]
  },
  "symbol": "TRND"
}